{
  "country_id": "TR",
  "name": {
    "tr": "Türkiye",
    "en": "Turkey"
  },
  "iso_alpha3": "TUR",
  "default_language": "tr",
  "languages": [
    "tr",
    "ku",
    "ar"
  ],
  "currency_code": "TRY",
  "phone_prefix": "+90",
  "continent": "europe",
  "emoji_flag": "🇹🇷",
  "updated_at": "2026-09-22T10:00:00Z"
}
